{"schema_version": "crypto_perp_event.v1", "artifact_id": "event-artifact-varied-03", "created_at": "2026-06-21T09:00:00Z", "producer": {"tool": "sis", "command": "crypto-perp-refresh"}, "source_refs": [], "boundary": {"permits_live_order": false, "live_conversion_allowed": false, "wallet_used": false, "signing_used": false, "exchange_write_used": false, "live_order_submitted": false}, "event_id": "event-varied-03", "event_family": "market_window_v1", "provider_id": "bitget", "native_symbol": "BTCUSDT", "canonical_symbol": "BTCUSDT", "first_detected_at": "2026-06-21T09:00:00Z", "information_cutoff_at": "2026-06-21T09:00:00Z", "universe_snapshot_id": "universe-varied-03", "market_snapshot_id": "market-varied-03", "detector_version": "crypto_perp_event_detector.v1", "detector_config_hash": "1660b29d7da7309d0898e046bc47af4f42afe5911e74e87759f6aa839958193d", "features_at_detection": {"return_15m": "-0.02", "return_60m": "-0.08", "return_74h": "-0.06", "recent_turnover": "355200", "previous_turnover": "296000", "turnover_impulse": "0.19", "robust_return_z": "3.3", "turnover_percentile": "0.903", "spread_bps": "1.90476190", "mark_index_basis_bps": "96.15384615384615384615384615", "funding_rate": "0.0004", "open_interest_raw": "1234"}, "market_context": {"btc_return": "-0.015", "eth_return": "-0.0075", "cross_section_median_return": "-0.005", "breadth": "-0.1", "market_adjusted_return": "-0.065"}, "data_quality": {"status": "PASS", "reason_codes": []}, "capture_request": {"requested": true, "channels": ["trades", "books1", "books15"], "duration_minutes": 360}, "status": "CAPTURE_REQUESTED"}